<?xml version="1.0" encoding="UTF-8"?>
<!--
/**
 * Copyright Â© 2015 Magento. All rights reserved.
 * See COPYING.txt for license details.
 */
-->
<xs:schema xmlns:xs="http://www.w3.org/2001/XMLSchema">
    <xs:element name="config">
        <xs:annotation>
            <xs:documentation>
                The root element for configuration data.
            </xs:documentation>
        </xs:annotation>
        <xs:complexType>
            <xs:sequence>
                <xs:element ref="testCase" maxOccurs="unbounded" minOccurs="1">
                    <xs:annotation>
                        <xs:documentation>
                            An element that contains configuration data of a test case.
                        </xs:documentation>
                    </xs:annotation>
                </xs:element>
            </xs:sequence>
        </xs:complexType>
    </xs:element>

    <xs:element name="testCase">
        <xs:complexType>
            <xs:sequence>
                <xs:element ref="variation" maxOccurs="unbounded" minOccurs="1">
                    <xs:annotation>
                        <xs:documentation>
                            An element that contains configuration data of a test case variation.
                        </xs:documentation>
                    </xs:annotation>
                </xs:element>
            </xs:sequence>
            <xs:attribute type="xs:string" name="name" use="required"/>
        </xs:complexType>
    </xs:element>

    <xs:element name="variation">
        <xs:complexType>
            <xs:sequence>
                <xs:element ref="data" maxOccurs="unbounded" minOccurs="1">
                    <xs:annotation>
                        <xs:documentation>
                            An element that contains a single configuration data set of a test case variation.
                        </xs:documentation>
                    </xs:annotation>
                </xs:element>
            </xs:sequence>
            <xs:attribute type="xs:string" name="name" use="required"/>
        </xs:complexType>
    </xs:element>

    <xs:element name="data">
        <xs:complexType>
            <xs:simpleContent>
                <xs:extension base="xs:string">
                    <xs:attribute type="xs:string" name="name" use="required"/>
                </xs:extension>
            </xs:simpleContent>
        </xs:complexType>
    </xs:element>
</xs:schema>
