<?xml version="1.0" encoding="utf-8"?>
<!--
/**
 * Copyright Â© 2015 Magento. All rights reserved.
 * See COPYING.txt for license details.
 */
 -->
<config xmlns:xsi="http://www.w3.org/2001/XMLSchema-instance" xsi:noNamespaceSchemaLocation="../../../../../../etc/global/variations.xsd">
    <testCase name="CreateProductReviewFrontendEntityTest">
        <variation name="CreateProductReviewFrontendEntityTestVariation1">
            <data name="description">Create product review with rating</data>
            <data name="review/data/customer">-</data>
            <data name="review/data/nickname">name_%isolation%</data>
            <data name="review/data/title">title_%isolation%</data>
            <data name="review/data/detail">review_%isolation%</data>
            <data name="review/data/ratings/1/dataSet">visibleOnDefaultWebsite</data>
            <data name="review/data/ratings/1/rating">4</data>
            <data name="review/data/entity_id/dataSet">catalogProductSimple::default</data>
            <data name="constraint">assertReviewCreationSuccessMessage, assertProductReviewInGrid, assertProductRatingOnReviewPage, assertProductRatingInProductPage</data>
        </variation>
        <variation name="CreateProductReviewFrontendEntityTestVariation2">
            <data name="description">MAGETWO-12403 - Add Product Review from Customer's Prospective</data>
            <data name="review/data/customer">Guest</data>
            <data name="review/data/nickname">name_%isolation%</data>
            <data name="review/data/title">title_%isolation%</data>
            <data name="review/data/detail">review_%isolation%</data>
            <data name="review/data/ratings/1/dataSet">-</data>
            <data name="review/data/ratings/1/rating">-</data>
            <data name="review/data/entity_id/dataSet">catalogProductSimple::default</data>
            <data name="constraint">assertReviewCreationSuccessMessage, assertProductReviewIsAbsentOnProductPage, assertProductReviewForm, assertSetApprovedProductReview, assertReviewLinksIsPresentOnProductPage, assertProductReviewOnProductPage</data>
            <data name="tag">bamboo_plan:end_to_end,test_type:acceptance_test</data>
        </variation>
    </testCase>
</config>
