<?xml version="1.0" encoding="utf-8"?>
<!--
/**
 * Copyright Â© 2015 Magento. All rights reserved.
 * See COPYING.txt for license details.
 */
 -->
<config xmlns:xsi="http://www.w3.org/2001/XMLSchema-instance" xsi:noNamespaceSchemaLocation="../../../../../../etc/global/variations.xsd">
    <testCase name="CreateStoreGroupEntityTest">
        <variation name="CreateStoreGroupEntityTestVariation1">
            <data name="storeGroup/data/website_id/dataSet">main_website</data>
            <data name="storeGroup/data/name">store_name_%isolation%</data>
            <data name="storeGroup/data/root_category_id/dataSet">default_category</data>
            <data name="constraint">assertStoreGroupSuccessSaveMessage, assertStoreGroupInGrid, assertStoreGroupForm, assertStoreGroupOnStoreViewForm</data>
        </variation>
        <variation name="CreateStoreGroupEntityTestVariation2">
            <data name="storeGroup/data/website_id/dataSet">custom_website</data>
            <data name="storeGroup/data/name">store_name_%isolation%</data>
            <data name="storeGroup/data/root_category_id/dataSet">root_category</data>
            <data name="constraint">assertStoreGroupSuccessSaveMessage, assertStoreGroupInGrid, assertStoreGroupForm, assertStoreGroupOnStoreViewForm</data>
        </variation>
    </testCase>
</config>
