<?xml version="1.0" encoding="utf-8"?>
<!--
/**
 * Copyright Â© 2015 Magento. All rights reserved.
 * See COPYING.txt for license details.
 */
 -->
<config xmlns:xsi="http://www.w3.org/2001/XMLSchema-instance" xsi:noNamespaceSchemaLocation="../../../../../../../etc/global/variations.xsd">
    <testCase name="testCreateCustomer">
        <variation name="testCreateCustomerVariation1">
            <data name="customer/data/firstname">john</data>
            <data name="customer/data/lastname">doe</data>
            <data name="customer/data/email">johndoe%isolation%@example.com</data>
            <data name="customer/data/is_subscribed">No</data>
            <data name="customer/data/password">123123q</data>
            <data name="customer/data/password_confirmation">123123q</data>
            <data name="constraint">assertCustomerSuccessRegisterMessage, assertCustomerInGrid</data>
        </variation>
        <variation name="testCreateCustomerVariation2">
            <data name="customer/data/firstname">john</data>
            <data name="customer/data/lastname">doe</data>
            <data name="customer/data/email">johndoe%isolation%@example.com</data>
            <data name="customer/data/is_subscribed">Yes</data>
            <data name="customer/data/password">123123q</data>
            <data name="customer/data/password_confirmation">123123q</data>
            <data name="constraint">assertCustomerSuccessRegisterMessage, assertCustomerInGrid, assertCustomerForm, assertCustomerIsSubscribedToNewsletter</data>
        </variation>
    </testCase>
</config>
