<?xml version="1.0" encoding="utf-8"?>
<!--
/**
 * Copyright Â© 2015 Magento. All rights reserved.
 * See COPYING.txt for license details.
 */
 -->
<config xmlns:xsi="http://www.w3.org/2001/XMLSchema-instance" xsi:noNamespaceSchemaLocation="../../../../../../etc/global/variations.xsd">
    <testCase name="DeleteUserRoleEntityTest">
        <variation name="DeleteUserRoleEntityTestVariation1">
            <data name="isDefaultUser">0</data>
            <data name="constraint">assertImpossibleDeleteYourOwnRole, assertRoleInGrid</data>
        </variation>
        <variation name="DeleteUserRoleEntityTestVariation2">
            <data name="isDefaultUser">1</data>
            <data name="constraint">assertRoleSuccessDeleteMessage, assertRoleNotInGrid</data>
        </variation>
    </testCase>
</config>
