<?xml version="1.0" encoding="utf-8"?>
<!--
/**
 * Copyright Â© 2015 Magento. All rights reserved.
 * See COPYING.txt for license details.
 */
 -->
<config xmlns:xsi="http://www.w3.org/2001/XMLSchema-instance" xsi:noNamespaceSchemaLocation="../../../../../../etc/global/variations.xsd">
    <testCase name="CreateSitemapEntityTest">
        <variation name="CreateSitemapEntityTestVariation1">
            <data name="sitemap/data/sitemap_filename">sitemap.xml</data>
            <data name="sitemap/data/sitemap_path">/</data>
            <data name="constraint">assertSitemapSuccessSaveMessage, assertSitemapInGrid</data>
        </variation>
        <variation name="CreateSitemapEntityTestVariation2">
            <data name="sitemap/data/sitemap_filename">%isolation%</data>
            <data name="sitemap/data/sitemap_path">/</data>
            <data name="constraint">assertSitemapFailPathSaveMessage</data>
        </variation>
        <variation name="CreateSitemapEntityTestVariation3">
            <data name="sitemap/data/sitemap_filename">sitemap.xml</data>
            <data name="sitemap/data/sitemap_path">/%isolation%</data>
            <data name="constraint">assertSitemapFailFolderSaveMessage</data>
        </variation>
    </testCase>
</config>
