<?xml version="1.0" encoding="utf-8"?>
<!--
/**
 * Copyright Â© 2015 Magento. All rights reserved.
 * See COPYING.txt for license details.
 */
 -->
<config xmlns:xsi="http://www.w3.org/2001/XMLSchema-instance" xsi:noNamespaceSchemaLocation="../../../../../../etc/global/variations.xsd">
    <testCase name="UpdateProductReviewEntityOnProductPageTest">
        <variation name="UpdateProductReviewEntityOnProductPageTestVariation1">
            <data name="rating">3</data>
            <data name="review/data/status_id">Approved</data>
            <data name="productRating/data/select_stores">Main Website/Main Website Store/Default Store View</data>
            <data name="review/data/nickname">name%isolation%</data>
            <data name="review/data/title">title%isolation%</data>
            <data name="review/data/detail">details%isolation%</data>
            <data name="constraint">assertProductReviewBackendSuccessSaveMessage, assertProductReviewInGrid, assertProductReviewOnProductPage, assertProductRatingInProductPage</data>
        </variation>
    </testCase>
</config>
