<?xml version="1.0" encoding="utf-8"?>
<!--
/**
 * Copyright Â© 2015 Magento. All rights reserved.
 * See COPYING.txt for license details.
 */
 -->
<config xmlns:xsi="http://www.w3.org/2001/XMLSchema-instance" xsi:noNamespaceSchemaLocation="../../../../../../etc/global/variations.xsd">
    <testCase name="UpdateShoppingCartTest">
        <variation name="UpdateShoppingCartTestVariation1">
            <data name="product/dataSet">default</data>
            <data name="product/data/price/value">100</data>
            <data name="product/data/checkout_data/qty">3</data>
            <data name="product/data/checkout_data/cartItem/price">100</data>
            <data name="product/data/checkout_data/cartItem/subtotal">300</data>
            <data name="constraint">assertPriceInShoppingCart, assertProductQtyInShoppingCart, assertProductQtyInMiniShoppingCart, assertSubtotalInShoppingCart</data>
        </variation>
        <variation name="UpdateShoppingCartTestVariation2">
            <data name="product/dataSet">with_two_custom_option</data>
            <data name="product/data/price/value">50</data>
            <data name="product/data/checkout_data/qty">11</data>
            <data name="product/data/checkout_data/cartItem/price">65</data>
            <data name="product/data/checkout_data/cartItem/subtotal">715</data>
            <data name="constraint">assertPriceInShoppingCart, assertProductQtyInShoppingCart, assertProductQtyInMiniShoppingCart, assertSubtotalInShoppingCart</data>
        </variation>
    </testCase>
</config>
