<?xml version="1.0" encoding="utf-8"?>
<!--
/**
 * Copyright Â© 2015 Magento. All rights reserved.
 * See COPYING.txt for license details.
 */
 -->
<config xmlns:xsi="http://www.w3.org/2001/XMLSchema-instance" xsi:noNamespaceSchemaLocation="../../../../../../etc/global/variations.xsd">
    <testCase name="ManageProductReviewFromCustomerPageTest">
        <variation name="ManageProductReviewFromCustomerPageTestVariation1">
            <data name="review/data/status_id">Approved</data>
            <data name="review/data/nickname">name_upd_%isolation%</data>
            <data name="review/data/title">title_upd_%isolation%</data>
            <data name="review/data/detail">review_upd_%isolation%</data>
            <data name="constraint">assertReviewSuccessSaveMessage, assertProductReviewInGridOnCustomerPage, assertProductReviewOnProductPage</data>
        </variation>
        <variation name="ManageProductReviewFromCustomerPageTestVariation2">
            <data name="review/data/status_id">Not Approved</data>
            <data name="review/data/nickname">name_upd_%isolation%</data>
            <data name="review/data/title">title_upd_%isolation%</data>
            <data name="review/data/detail">review_upd_%isolation%</data>
            <data name="constraint">assertReviewSuccessSaveMessage, assertProductReviewInGridOnCustomerPage, assertProductRatingNotInProductPage</data>
        </variation>
    </testCase>
</config>
