<?xml version="1.0" encoding="utf-8"?>
<!--
/**
 * Copyright Â© 2015 Magento. All rights reserved.
 * See COPYING.txt for license details.
 */
 -->
<config xmlns:xsi="http://www.w3.org/2001/XMLSchema-instance" xsi:noNamespaceSchemaLocation="../../../../../../../etc/global/variations.xsd">
    <testCase name="DeleteProductAttributeEntityTest">
        <variation name="DeleteProductAttributeEntityTestVariation1">
            <data name="attribute/dataSet">attribute_type_text_field</data>
            <data name="isRequired">Yes</data>
            <data name="constraint">assertProductAttributeSuccessDeleteMessage, assertProductAttributeAbsenceInGrid, assertProductAttributeAbsenceInSearchOnProductForm, assertProductAttributeAbsenceForExport</data>
        </variation>
        <variation name="DeleteProductAttributeEntityTestVariation2">
            <data name="attribute/dataSet">attribute_type_dropdown</data>
            <data name="isRequired">No</data>
            <data name="constraint">assertProductAttributeSuccessDeleteMessage, assertProductAttributeAbsenceInGrid, assertProductAttributeAbsenceInSearchOnProductForm, assertProductAttributeAbsenceForExport</data>
        </variation>
    </testCase>
</config>
